{
  "review_id": "TS-2026-08-05-web-craft-round-2",
  "rubric_id": "talent-signal-web-browser-craft-v1",
  "artifact": {
    "version": "665aabcbbaf0224714c938e2f664f85f04c24b2f",
    "review_objects": [
      "web",
      "integrated_localhost_journey"
    ],
    "example_only": false
  },
  "dimension_results": [
    {
      "dimension_id": "product_specificity",
      "in_scope": true,
      "score": 99,
      "evidence_level": "direct",
      "evidence_locators": [
        "docs/evaluations/round-2/web/browser/journey-trace.json",
        "docs/evaluations/round-2/web/browser/state-matrix.json"
      ],
      "exact_gap": "No uncoached recruiter session proves that every product-specific boundary is recognized without explanation.",
      "not_applicable_reason": null
    },
    {
      "dimension_id": "narrative_clarity",
      "in_scope": true,
      "score": 96,
      "evidence_level": "direct",
      "evidence_locators": [
        "docs/evaluations/round-2/web/browser/journey-trace.json",
        "docs/evaluations/round-2/web/screenshots/03c-readback-verified-1440-production.png"
      ],
      "exact_gap": "The ordered evidence-to-outcome story is direct, but no first-time participant recording proves comprehension without coaching.",
      "not_applicable_reason": null
    },
    {
      "dimension_id": "attention_hierarchy",
      "in_scope": true,
      "score": 98,
      "evidence_level": "direct",
      "evidence_locators": [
        "docs/evaluations/round-2/web/browser/proposed-segments.json",
        "docs/evaluations/round-2/web/screenshots/03c-readback-verified-1440-production.png"
      ],
      "exact_gap": "No eye-tracking or uncoached task observation proves that the hierarchy survives unfamiliar use.",
      "not_applicable_reason": null
    },
    {
      "dimension_id": "evidence_proximity",
      "in_scope": true,
      "score": 97,
      "evidence_level": "direct",
      "evidence_locators": [
        "docs/evaluations/round-2/web/browser/proposed-segments.json",
        "docs/evaluations/round-2/web/screenshots/03-readback-verified-390.png"
      ],
      "exact_gap": "Exact anchors and corrected-versus-source values are direct, but no continuous interaction recording covers dismiss, conflict, and supersession in the backend-owned path.",
      "not_applicable_reason": null
    },
    {
      "dimension_id": "typography",
      "in_scope": true,
      "score": 96,
      "evidence_level": "direct",
      "evidence_locators": [
        "docs/evaluations/round-2/web/browser/viewport-motion.json",
        "docs/evaluations/round-2/web/screenshots/03-readback-verified-390.png"
      ],
      "exact_gap": "Native 200% browser zoom and long mixed-script content were not directly exercised.",
      "not_applicable_reason": null
    },
    {
      "dimension_id": "spacing_rhythm",
      "in_scope": true,
      "score": 98,
      "evidence_level": "direct",
      "evidence_locators": [
        "docs/evaluations/round-2/web/browser/proposed-segments.json",
        "docs/evaluations/round-2/web/screenshots/03c-readback-verified-1440-production.png"
      ],
      "exact_gap": "No direct browser-popup comparison or native zoom run covers the most constrained adjacent Web surface.",
      "not_applicable_reason": null
    },
    {
      "dimension_id": "restrained_color_state_semantics",
      "in_scope": true,
      "score": 97,
      "evidence_level": "direct",
      "evidence_locators": [
        "docs/evaluations/round-2/web/browser/state-matrix.json",
        "docs/evaluations/round-2/web/browser/accessibility-audit.json"
      ],
      "exact_gap": "Axe color-contrast checks remain incomplete, and no manual grayscale or increased-contrast review was captured.",
      "not_applicable_reason": null
    },
    {
      "dimension_id": "materiality",
      "in_scope": true,
      "score": 97,
      "evidence_level": "direct",
      "evidence_locators": [
        "docs/evaluations/round-2/web/screenshots/02-approved-separated-390.png",
        "docs/evaluations/round-2/web/screenshots/03c-readback-verified-1440-production.png"
      ],
      "exact_gap": "Reduced-transparency behavior and the loaded Chrome popup were not directly compared.",
      "not_applicable_reason": null
    },
    {
      "dimension_id": "interaction_motion",
      "in_scope": true,
      "score": 97,
      "evidence_level": "direct",
      "evidence_locators": [
        "docs/evaluations/round-2/web/browser/viewport-motion.json",
        "docs/evaluations/round-2/web/screenshots/10-loading-390.png"
      ],
      "exact_gap": "Reduced motion is direct, but cancellation and repeated-retry feedback were not recorded as a continuous production interaction.",
      "not_applicable_reason": null
    },
    {
      "dimension_id": "responsive_composition",
      "in_scope": true,
      "score": 97,
      "evidence_level": "direct",
      "evidence_locators": [
        "docs/evaluations/round-2/web/browser/journey-trace.json",
        "docs/evaluations/round-2/web/browser/viewport-motion.json"
      ],
      "exact_gap": "The authenticated 390 path is direct and unclipped, but native 200% browser zoom remains unproven.",
      "not_applicable_reason": null
    },
    {
      "dimension_id": "keyboard_focus_accessibility",
      "in_scope": true,
      "score": 97,
      "evidence_level": "direct",
      "evidence_locators": [
        "docs/evaluations/round-2/web/browser/keyboard-focus.json",
        "docs/evaluations/round-2/web/browser/aria-transcript.json",
        "docs/evaluations/round-2/web/browser/accessibility-audit.json"
      ],
      "exact_gap": "Final axe scans have zero violations and skip focus is direct, but manual screen-reader order, native 200% zoom, and manual contrast disposition remain unproven.",
      "not_applicable_reason": null
    },
    {
      "dimension_id": "loading_empty_error_recovery",
      "in_scope": true,
      "score": 99,
      "evidence_level": "direct",
      "evidence_locators": [
        "docs/evaluations/round-2/web/browser/state-matrix.json"
      ],
      "exact_gap": "Repeated failure and user-cancelled mutation recovery were not captured as continuous production interactions.",
      "not_applicable_reason": null
    }
  ],
  "integrated_journey": {
    "in_scope": true,
    "score": 0,
    "evidence_level": "insufficient",
    "evidence_locators": [
      "docs/evaluations/round-2/web/browser/journey-trace.json",
      "docs/evaluations/overnight/final/chrome-load-unpacked-gap.json"
    ],
    "exact_gap": "The Web-authenticated slice scores 97, but the active XS-CAPTURE-01 veto leaves the independent cross-surface integrated journey at zero."
  },
  "vetoes": [
    "XS-CAPTURE-01: the intentional Chrome capture and pre-Submit silence boundary is unproven."
  ],
  "findings": [
    {
      "criterion": "Native zoom and manual assistive technology",
      "gap": "The evidence contains 200%-equivalent reflow and automated AX inspection, not native browser zoom or a manual screen-reader traversal.",
      "evidence": "docs/evaluations/round-2/web/browser/viewport-motion.json",
      "owner": "Web accessibility",
      "pass_condition": "Direct native 200% zoom and VoiceOver or NVDA runs preserve reading, focus, labels, and decision order."
    },
    {
      "criterion": "First-use comprehension",
      "gap": "The production journey completed, but no uncoached first-time recruiter explained confirmation, approval, and verified outcome correctly.",
      "evidence": "docs/evaluations/round-2/web/browser/journey-trace.json",
      "owner": "Web product",
      "pass_condition": "A first-time recruiter completes TS-CORE-01 without prompting and accurately describes each authority transition."
    },
    {
      "criterion": "Intentional browser capture",
      "gap": "The current task did not and was not authorized to resolve XS-CAPTURE-01.",
      "evidence": "docs/evaluations/overnight/final/chrome-load-unpacked-gap.json",
      "owner": "Browser extension",
      "pass_condition": "A policy-authorized visible Chrome run proves temporary scope, exact preview, pre-Submit silence, explicit Submit, and one scoped receipt."
    }
  ],
  "verdict": "fail"
}
