{
  "review_id": "TS-2026-08-05-web-craft",
  "rubric_id": "talent-signal-web-browser-craft-v1",
  "artifact": {
    "version": "1c9c3f0f2866b2d4c3651d422f5d886dd796c996",
    "review_objects": [
      "web"
    ],
    "example_only": false
  },
  "dimension_results": [
    {
      "dimension_id": "product_specificity",
      "in_scope": true,
      "score": 96,
      "evidence_level": "direct",
      "evidence_locators": [
        "docs/evaluations/overnight/final/web-review-sequence.json",
        "docs/evaluations/overnight/final/web-desktop-before-review.png"
      ],
      "exact_gap": "The real Web run proves evidence, confirmation, approval, and observed outcome, but lacks direct Web screenshots for no_action, ambiguity, deletion, and blocked states.",
      "not_applicable_reason": null
    },
    {
      "dimension_id": "narrative_clarity",
      "in_scope": true,
      "score": 94,
      "evidence_level": "direct",
      "evidence_locators": [
        "docs/evaluations/overnight/final/web-review-sequence.json"
      ],
      "exact_gap": "The ordered screenshots show the intended story, but no uncoached first-use recording proves that a new reviewer can explain each transition.",
      "not_applicable_reason": null
    },
    {
      "dimension_id": "attention_hierarchy",
      "in_scope": true,
      "score": 93,
      "evidence_level": "direct",
      "evidence_locators": [
        "docs/evaluations/overnight/final/web-desktop-before-review.png",
        "docs/evaluations/overnight/final/web-desktop-facts-confirmed.png"
      ],
      "exact_gap": "The desktop decision hierarchy is direct, but the authenticated backend-owned state was not observed at 390 px or with long-content expansion.",
      "not_applicable_reason": null
    },
    {
      "dimension_id": "evidence_proximity",
      "in_scope": true,
      "score": 94,
      "evidence_level": "direct",
      "evidence_locators": [
        "docs/evaluations/overnight/final/web-desktop-before-review.png",
        "docs/evaluations/overnight/final/TS-CORE-01-state-parity.json"
      ],
      "exact_gap": "Exact source evidence and edit controls are visible, but no direct fact-to-source and action-to-source interaction recording covers dismissal, conflict, and supersession.",
      "not_applicable_reason": null
    },
    {
      "dimension_id": "typography",
      "in_scope": true,
      "score": 91,
      "evidence_level": "direct",
      "evidence_locators": [
        "docs/evaluations/overnight/final/web-desktop-verified-light.png",
        "docs/evaluations/overnight/final/web-desktop-verified-dark.png"
      ],
      "exact_gap": "Desktop light and dark text are legible, but the real flow lacks 390 px, 200% zoom, and long mixed-script typography evidence.",
      "not_applicable_reason": null
    },
    {
      "dimension_id": "spacing_rhythm",
      "in_scope": true,
      "score": 93,
      "evidence_level": "direct",
      "evidence_locators": [
        "docs/evaluations/overnight/final/web-review-sequence.json"
      ],
      "exact_gap": "The desktop sequence groups evidence and decisions coherently, but no direct narrow authenticated comparison proves the rhythm under constrained width.",
      "not_applicable_reason": null
    },
    {
      "dimension_id": "restrained_color_state_semantics",
      "in_scope": true,
      "score": 94,
      "evidence_level": "direct",
      "evidence_locators": [
        "docs/evaluations/overnight/final/web-desktop-verified-light.png",
        "docs/evaluations/overnight/final/web-desktop-verified-dark.png",
        "docs/evaluations/overnight/final/web-backend-offline.png"
      ],
      "exact_gap": "Light, dark, verified, and offline states are visibly distinct, but grayscale, increased-contrast, and complete proposed-to-deleted state matrices were not captured.",
      "not_applicable_reason": null
    },
    {
      "dimension_id": "materiality",
      "in_scope": true,
      "score": 95,
      "evidence_level": "direct",
      "evidence_locators": [
        "docs/evaluations/overnight/final/web-desktop-before-review.png",
        "docs/evaluations/overnight/final/web-approved-before-readback.png",
        "docs/evaluations/overnight/final/web-keyboard-focus.png"
      ],
      "exact_gap": "Editable, approvable, verified, and focused objects use coherent surfaces, but reduced-transparency and narrow-layout material behavior remain unobserved.",
      "not_applicable_reason": null
    },
    {
      "dimension_id": "interaction_motion",
      "in_scope": true,
      "score": 90,
      "evidence_level": "direct",
      "evidence_locators": [
        "docs/evaluations/overnight/final/web-review-sequence.json",
        "docs/evaluations/overnight/final/web-backend-recovered.png"
      ],
      "exact_gap": "The interactions and recovery completed correctly, but there is no direct recording of progress, cancellation, repeated retry feedback, or reduced-motion behavior.",
      "not_applicable_reason": null
    },
    {
      "dimension_id": "responsive_composition",
      "in_scope": true,
      "score": 82,
      "evidence_level": "supported_inference",
      "evidence_locators": [
        "docs/evaluations/overnight/final/web-reviewed-slice-mobile-light.png",
        "docs/evaluations/overnight/final/web-review-sequence.json"
      ],
      "exact_gap": "A reviewed slice renders narrowly, but the actual authenticated backend-owned edit, confirm, approve, and readback journey was not directly exercised at 390 px.",
      "not_applicable_reason": null
    },
    {
      "dimension_id": "keyboard_focus_accessibility",
      "in_scope": true,
      "score": 92,
      "evidence_level": "direct",
      "evidence_locators": [
        "docs/evaluations/overnight/final/web-keyboard-focus.png"
      ],
      "exact_gap": "Visible keyboard focus is direct, but no full focus-order recording, 200% zoom run, or screen-reader transcript covers the whole decision sequence.",
      "not_applicable_reason": null
    },
    {
      "dimension_id": "loading_empty_error_recovery",
      "in_scope": true,
      "score": 95,
      "evidence_level": "direct",
      "evidence_locators": [
        "docs/evaluations/overnight/final/web-backend-offline.png",
        "docs/evaluations/overnight/final/web-backend-recovered.png",
        "docs/evaluations/overnight/final/TS-CORE-01-recovery-matrix.json"
      ],
      "exact_gap": "Offline and recovery preserve truthful state, but the real Web surface lacks direct loading, empty, stale-approval, revoked, and deleted screenshots.",
      "not_applicable_reason": null
    }
  ],
  "integrated_journey": {
    "in_scope": false,
    "score": null,
    "evidence_level": "not_applicable",
    "evidence_locators": [],
    "exact_gap": "This packet scores Web craft only; the independent integrated-journey result is in web-browser-craft-review.json."
  },
  "vetoes": [],
  "findings": [
    {
      "criterion": "Responsive composition",
      "gap": "The real authenticated backend path was not directly run at 390 px.",
      "evidence": "docs/evaluations/overnight/final/web-review-sequence.json",
      "owner": "Web",
      "pass_condition": "The complete TS-CORE-01 edit-to-readback sequence remains usable and unclipped at 390 px."
    },
    {
      "criterion": "Assistive access",
      "gap": "Reduced-motion, 200% zoom, and screen-reader behavior were not directly observed.",
      "evidence": "docs/evaluations/overnight/final/web-keyboard-focus.png",
      "owner": "Web",
      "pass_condition": "Direct runs prove logical focus, readable reflow, correct announcements, and no essential motion."
    },
    {
      "criterion": "State breadth",
      "gap": "Direct Web evidence covers happy-path and offline recovery but not every ambiguity, no_action, stale, revoked, and deleted state.",
      "evidence": "docs/evaluations/overnight/final/web-review-sequence.json",
      "owner": "Web",
      "pass_condition": "A direct state matrix shows every declared boundary with truthful labels and preserved recovery."
    }
  ],
  "verdict": "needs_correction"
}
