{
  "review_id": "TS-2026-08-05-integrated-web-browser-craft",
  "rubric_id": "talent-signal-web-browser-craft-v1",
  "artifact": {
    "version": "1c9c3f0f2866b2d4c3651d422f5d886dd796c996",
    "review_objects": [
      "chrome_browser_extension",
      "web",
      "integrated_localhost_journey"
    ],
    "example_only": false
  },
  "dimension_results": [
    {
      "dimension_id": "product_specificity",
      "in_scope": true,
      "score": 93,
      "evidence_level": "supported_inference",
      "evidence_locators": [
        "docs/evaluations/overnight/final/web-review-sequence.json",
        "docs/evaluations/overnight/final/chrome-reviewed-slice-ts-core-01-review.png"
      ],
      "exact_gap": "Web directly expresses the full Talent Signal authority model, but the extension half is reviewed-slice evidence and the real cross-surface start is unproven.",
      "not_applicable_reason": null
    },
    {
      "dimension_id": "narrative_clarity",
      "in_scope": true,
      "score": 90,
      "evidence_level": "supported_inference",
      "evidence_locators": [
        "docs/evaluations/overnight/final/web-review-sequence.json",
        "docs/evaluations/overnight/final/chrome-load-unpacked-gap.json"
      ],
      "exact_gap": "The backend-to-Web-to-iOS story is ordered, but no uncoached recording starts with a real extension invocation and continues through verified readback.",
      "not_applicable_reason": null
    },
    {
      "dimension_id": "attention_hierarchy",
      "in_scope": true,
      "score": 90,
      "evidence_level": "supported_inference",
      "evidence_locators": [
        "docs/evaluations/overnight/final/web-desktop-before-review.png",
        "docs/evaluations/overnight/final/chrome-reviewed-slice-ts-core-01-review.png"
      ],
      "exact_gap": "Each reviewed surface presents one current decision, but a real popup-to-Web comparison and direct authenticated 390 px view are missing.",
      "not_applicable_reason": null
    },
    {
      "dimension_id": "evidence_proximity",
      "in_scope": true,
      "score": 91,
      "evidence_level": "supported_inference",
      "evidence_locators": [
        "docs/evaluations/overnight/final/TS-CORE-01-state-parity.json",
        "docs/evaluations/overnight/final/web-desktop-before-review.png",
        "docs/evaluations/overnight/final/chrome-load-unpacked-gap.json"
      ],
      "exact_gap": "Backend, Web, and iOS retain exact source identity and spans, but the actual active-tab or selected-text provenance boundary was not captured in loaded Chrome.",
      "not_applicable_reason": null
    },
    {
      "dimension_id": "typography",
      "in_scope": true,
      "score": 89,
      "evidence_level": "supported_inference",
      "evidence_locators": [
        "docs/evaluations/overnight/final/web-desktop-verified-light.png",
        "docs/evaluations/overnight/final/chrome-reviewed-slice-dark-320.png",
        "docs/evaluations/overnight/final/ios-review-sequence.json"
      ],
      "exact_gap": "Readable desktop, reviewed popup, and AX5 iOS evidence exists, but direct popup text, Web 390 px, Web 200% zoom, and mixed-script extremes are missing.",
      "not_applicable_reason": null
    },
    {
      "dimension_id": "spacing_rhythm",
      "in_scope": true,
      "score": 90,
      "evidence_level": "supported_inference",
      "evidence_locators": [
        "docs/evaluations/overnight/final/web-review-sequence.json",
        "docs/evaluations/overnight/final/chrome-reviewed-slice-ts-core-01-review.png",
        "docs/evaluations/overnight/final/ios-review-sequence.json"
      ],
      "exact_gap": "The captured surfaces are calm and grouped, but actual Chrome popup and real narrow Web comparisons are absent.",
      "not_applicable_reason": null
    },
    {
      "dimension_id": "restrained_color_state_semantics",
      "in_scope": true,
      "score": 91,
      "evidence_level": "supported_inference",
      "evidence_locators": [
        "docs/evaluations/overnight/final/web-desktop-verified-dark.png",
        "docs/evaluations/overnight/final/web-backend-offline.png",
        "docs/evaluations/overnight/final/chrome-reviewed-slice-permission-denied.png",
        "docs/evaluations/overnight/final/ios-review-sequence.json"
      ],
      "exact_gap": "State labels do not rank candidates and survive the captured themes, but real popup, grayscale, increased-contrast, and full cross-state matrices are missing.",
      "not_applicable_reason": null
    },
    {
      "dimension_id": "materiality",
      "in_scope": true,
      "score": 91,
      "evidence_level": "supported_inference",
      "evidence_locators": [
        "docs/evaluations/overnight/final/web-keyboard-focus.png",
        "docs/evaluations/overnight/final/chrome-reviewed-slice-ts-core-01-received.png",
        "docs/evaluations/overnight/final/ios-review-sequence.json"
      ],
      "exact_gap": "Web and iOS direct cues are coherent and the popup slice aligns, but actual popup selection, focus, pressed, and transient states are unobserved.",
      "not_applicable_reason": null
    },
    {
      "dimension_id": "interaction_motion",
      "in_scope": true,
      "score": 0,
      "evidence_level": "insufficient",
      "evidence_locators": [
        "docs/evaluations/overnight/final/chrome-load-unpacked-gap.json",
        "docs/evaluations/overnight/final/web-review-sequence.json"
      ],
      "exact_gap": "The integrated journey cannot prove its initial explicit capture, temporary permission, pre-Submit silence, or loaded-extension Submit interaction; reduced-motion behavior is also unobserved.",
      "not_applicable_reason": null
    },
    {
      "dimension_id": "responsive_composition",
      "in_scope": true,
      "score": 80,
      "evidence_level": "supported_inference",
      "evidence_locators": [
        "docs/evaluations/overnight/final/web-reviewed-slice-mobile-light.png",
        "docs/evaluations/overnight/final/chrome-reviewed-slice-dark-320.png",
        "docs/evaluations/overnight/final/ios-review-sequence.json"
      ],
      "exact_gap": "iOS is direct and reviewed slices are narrow, but neither the actual loaded popup nor the authenticated Web backend path was directly exercised at required narrow widths.",
      "not_applicable_reason": null
    },
    {
      "dimension_id": "keyboard_focus_accessibility",
      "in_scope": true,
      "score": 78,
      "evidence_level": "supported_inference",
      "evidence_locators": [
        "docs/evaluations/overnight/final/web-keyboard-focus.png",
        "docs/evaluations/overnight/final/ios-review-sequence.json",
        "docs/evaluations/overnight/final/chrome-load-unpacked-gap.json"
      ],
      "exact_gap": "Web focus and iOS AX5 are direct, but no loaded-popup keyboard path, cross-surface screen-reader transcript, or Web 200% zoom run exists.",
      "not_applicable_reason": null
    },
    {
      "dimension_id": "loading_empty_error_recovery",
      "in_scope": true,
      "score": 90,
      "evidence_level": "supported_inference",
      "evidence_locators": [
        "docs/evaluations/overnight/final/TS-CORE-01-recovery-matrix.json",
        "docs/evaluations/overnight/final/web-backend-offline.png",
        "docs/evaluations/overnight/final/web-backend-recovered.png",
        "docs/evaluations/overnight/final/chrome-reviewed-slice-offline-retry-received.png"
      ],
      "exact_gap": "Deterministic boundary checks and direct Web recovery pass, but the real loaded extension was not observed through offline, permission denial, and retry.",
      "not_applicable_reason": null
    }
  ],
  "integrated_journey": {
    "in_scope": true,
    "score": 0,
    "evidence_level": "insufficient",
    "evidence_locators": [
      "docs/evaluations/overnight/final/chrome-load-unpacked-gap.json",
      "docs/evaluations/overnight/final/web-review-sequence.json",
      "docs/evaluations/overnight/final/ios-review-sequence.json",
      "docs/evaluations/overnight/final/TS-CORE-01-state-parity.json"
    ],
    "exact_gap": "The active XS-CAPTURE-01 evidence-safety veto means the journey does not meet the rubric's first anchor even though the backend, Web, iOS, and repository-local plugin portions are proven."
  },
  "vetoes": [
    "XS-CAPTURE-01: the intentional Chrome capture and pre-Submit silence boundary is unproven."
  ],
  "findings": [
    {
      "criterion": "Integrated capture boundary",
      "gap": "No direct loaded-extension toolbar or selected-text capture exists.",
      "evidence": "docs/evaluations/overnight/final/chrome-load-unpacked-gap.json",
      "owner": "Browser extension",
      "pass_condition": "A policy-authorized real Chrome run proves one temporary capture grant, exact preview, pre-Submit silence, one Submit, and one backend receipt."
    },
    {
      "criterion": "Responsive and assistive access",
      "gap": "Authenticated Web 390 px, reduced motion, 200% zoom, screen-reader, and loaded-popup keyboard evidence are absent.",
      "evidence": "docs/evaluations/overnight/final/web-review-sequence.json",
      "owner": "Web and browser extension",
      "pass_condition": "Direct runs prove complete, reachable, correctly announced decisions across the required viewport and assistive settings."
    },
    {
      "criterion": "Host-installed analyzer path",
      "gap": "Repository-local installed-copy parity passes, but the actual Codex host plugin could not be installed from the configured marketplace.",
      "evidence": "docs/evaluations/overnight/final/plugin-installed-copy-proof.json",
      "owner": "Codex plugin",
      "pass_condition": "The exact frozen plugin installs in the Codex host and TS-CORE-01 returns the same semantic layers without external tools or effects."
    }
  ],
  "verdict": "fail"
}
